Title,Price,Boughts
"Alpha GPC Choline 600mg Capsules - Brain Support Supplement for Focus, Memory, Motivation, Energy by Double Wood","$19.85","4K+ bought in past month"
"Nutricost Vitamin K2 MK-7 100 mcg, 240 Softgels - Gluten Free and Non-GMO MK7","$20.99","6K+ bought in past month"
"NusaPure Benfotiamine 300mg Per Veggie Caps 220 Count (Non-GMO, Vegan, Gluten-Free) Bioperine","$29.54","600+ bought in past month"
"Phosphatidylserine 500mg 180 Vegetarian Capsules | Soy Free Non GMO Made in USA | Nootropic Brain Supplement | Natural Memory Ultimate | PS Pure Complex 500 mg Powder Pill","$25.90","300+ bought in past month"
"Joyli Berberine 1500MG - 180 Vegan Capsules - for Diet, Immune & Heart Support - Berberine Supplement, Colloidal Gold Berberines Plus Bernerine, Berberine HCL - 3X The Potency of Berberine 500mg","$21.99","2K+ bought in past month"
"Lycopene 50mg 180 Vegetarian Capsules | Supplement Health | Natural Tomato Extract Non-GMO | Pure Powder","$33.93","1K+ bought in past month"
"Nutricost CDP Choline (Citicoline) 300mg, 120 Vegetarian Capsules - Non-GMO, Vegetarian Friendly, Gluten Free","$26.95","800+ bought in past month"
"Nootropics Depot Palmitoylethanolamide Capsules | Pea | 400mg Pills | 180 Count | Supports Pain Management* | Promotes Healthy Inflammatory Responses*","$76.99","100+ bought in past month"
"Jarrow Formulas Citrus Bergamot 500 mg - 60 Servings (Veggie Caps) - Antioxidant Support for Cardiovascular & Metabolic Health - Dietary Supplement - Gluten Free - Use with Jarrow Formulas QH-absorb","$27.30 with 44 percent savings","700+ bought in past month"
"Centrophenoxine 300 mg - 120 Vegetarian Capsules | Supplement Made in USA | Cognitive Enhancer Nootropic | Promotes Healthy Aging & Brain Function | Supports Memory & Focus | 300mg Pure Powder Pills","$26.90","100+ bought in past month"
"Immune Support Quercetin with Bromelain Supplement- Quercetin 500mg & Bromelain 100mg Per Serving Antioxidant Supplement Joint Support Lung Health and Immunity- Advanced Quercetin Bromelain Supplement","$26.19","300+ bought in past month"
"Uridine Monophosphate - Third Party Tested (Choline Enhancer, Beginner Nootropic) 300mg, Manufactured in USA (60 Capsules) Synergy with Alpha GPC Choline for Brain Health and Memory by Double Wood","$24.95","700+ bought in past month"
"Optimum Nutrition Gold Standard 100% Whey Protein Powder, Double Rich Chocolate, 10 Pound (Packaging May Vary)","$157.99","7K+ bought in past month"
"Amazon Basics Low-Profile Wired USB Keyboard with US Layout (QWERTY), Matte Black","$13.94","10K+ bought in past month"
"Amazon Basics Low-Profile Wired USB Keyboard with US Layout (QWERTY), Matte Black","$13.94","10K+ bought in past month"
"Amazon Basics Low-Profile Wired USB Keyboard with US Layout (QWERTY), Matte Black","$13.94","10K+ bought in past month"
"Amazon Basics Low-Profile Wired USB Keyboard with US Layout (QWERTY), Matte Black","$13.94","10K+ bought in past month"
"Gaming Keyboard, 104 Keys All-Metal Panel, Rainbow LED Backlit Quiet Computer Keyboard, Wrist Rest, Multimedia Keys, Anti-ghosting Keys, Waterproof Light Up USB Wired Keyboard for PC Mac Xbox","$23.86 with 40 percent savings","1K+ bought in past month"
"MageGee Portable 60% Mechanical Gaming Keyboard, MK-Box LED Backlit Compact 68 Keys Mini Wired Office Keyboard with Red Switch for Windows Laptop PC Mac - Black/Grey","$25.49 with 15 percent savings","4K+ bought in past month"
"Nutricost Creatine Monohydrate Micronized Powder 500G, 5000mg Per Serv (5g) - Micronized Creatine Monohydrate, 100 Servings","$32.95","100K+ bought in past month"
"Nutricost Creatine Monohydrate Micronized Powder 500G, 5000mg Per Serv (5g) - Micronized Creatine Monohydrate, 100 Servings","$32.95","100K+ bought in past month"
"Lenovo 2022 Newest Ideapad 3 Laptop, 15.6" HD Touchscreen, 11th Gen Intel Core i3-1115G4 Processor, 8GB DDR4 RAM, 256GB PCIe NVMe SSD, HDMI, Webcam, Wi-Fi 5, Bluetooth, Windows 11 Home, Almond","$337.99","500+ bought in past month"
"Acer Nitro 5 AN515-58-57Y8 Gaming Laptop | Intel Core i5-12500H | NVIDIA GeForce RTX 3050 Ti Laptop GPU | 15.6" FHD 144Hz IPS Display | 16GB DDR4 | 512GB Gen 4 SSD | Killer Wi-Fi 6 | Backlit Keyboard","$770.00","500+ bought in past month"
"Acer Nitro 5 AN515-58-57Y8 Gaming Laptop | Intel Core i5-12500H | NVIDIA GeForce RTX 3050 Ti Laptop GPU | 15.6" FHD 144Hz IPS Display | 16GB DDR4 | 512GB Gen 4 SSD | Killer Wi-Fi 6 | Backlit Keyboard","$770.00","500+ bought in past month"
"Apple iPhone 13, 128GB, Midnight - Unlocked (Renewed)","$593.84","2K+ bought in past month"
